{
  "openabtest": "0.2-draft",
  "producerId": "chovy-server",
  "manifestId": "signup-cta-v1",
  "manifestRevision": 1,
  "participantId": "participant-opaque-7d12",
  "at": "2026-09-15T12:00:00Z",
  "id": "event-goal-42",
  "kind": "conversion",
  "payload": {
    "assignmentId": "assignment-42",
    "variantId": "free",
    "conversionId": "signup-42",
    "goal": "signup-completed"
  }
}
